{
  "schema_version": 1,
  "contract": "podcast-reader-boundary-policy",
  "policy_revision": 3,
  "data_classes": [
    {"id": "content.audio", "sensitivity": "user-content", "description": "User-selected media bytes or samples."},
    {"id": "content.reversible-derivative", "sensitivity": "user-content", "description": "Embeddings or other representations from which transcript content can be recovered."},
    {"id": "content.transcript-html", "sensitivity": "user-content", "description": "Rendered transcript artifact including its text."},
    {"id": "content.transcript-plaintext", "sensitivity": "user-content", "description": "Plain transcript text and user-visible transcript title."},
    {"id": "identity.account-subject", "sensitivity": "personal", "description": "Opaque premium account subject and subject-bound revisions."},
    {"id": "identity.device", "sensitivity": "personal", "description": "Device authorization identity and client kind."},
    {"id": "locator.external-cta-url", "sensitivity": "public", "description": "Validated HTTPS destination in house creative."},
    {"id": "locator.feed-url", "sensitivity": "user-content", "description": "A feed locator selected or subscribed by the user."},
    {"id": "locator.media-url", "sensitivity": "user-content", "description": "A submitted or resolved remote media locator."},
    {"id": "metadata.cookie-jar", "sensitivity": "personal", "description": "Cookie-jar domain and timestamps without cookie values."},
    {"id": "metadata.delivery-receipt", "sensitivity": "personal", "description": "Content-free delivery IDs, state, attempts, timestamps, and error code."},
    {"id": "metadata.entitlement", "sensitivity": "personal", "description": "Tier, capabilities, revisions, and expiry bound to an account subject."},
    {"id": "metadata.house-creative", "sensitivity": "public", "description": "Bounded native title, body, placement, expiry, and CTA."},
    {"id": "metadata.job", "sensitivity": "user-content", "description": "Job identity, source, title, state, progress, and bounded errors."},
    {"id": "metadata.library", "sensitivity": "user-content", "description": "Library identity, source, title, artifact path, and timestamps."},
    {"id": "metadata.public-configuration", "sensitivity": "public", "description": "Non-secret health, settings, pack, provider, and application status."},
    {"id": "metadata.subscription", "sensitivity": "user-content", "description": "Subscription identity, feed origin, state, schedule, and bounded errors."},
    {"id": "secret.cookie-jar", "sensitivity": "credential", "description": "Cookie names and values captured for authenticated source fetching."},
    {"id": "secret.device-code", "sensitivity": "credential", "description": "Short-lived device and user authorization codes."},
    {"id": "secret.engine-bearer", "sensitivity": "credential", "description": "Bearer authenticating local or tailnet engine requests."},
    {"id": "secret.premium-access", "sensitivity": "credential", "description": "Short-lived premium access bearer."},
    {"id": "secret.premium-refresh", "sensitivity": "credential", "description": "Rotating premium refresh credential."},
    {"id": "secret.provider-api-key", "sensitivity": "credential", "description": "User-supplied model-provider API key."}
  ],
  "zones": [
    {"id": "android.app", "retention": "process", "description": "Android application process and UI."},
    {"id": "android.credential-store", "retention": "encrypted-local", "description": "Android domain-separated encrypted credential storage."},
    {"id": "approved.billing-provider", "retention": "third-party", "description": "Configured Stripe API used only for premium checkout and webhook control."},
    {"id": "approved.content-host", "retention": "third-party", "description": "User-selected feed, media, and YouTube content hosts."},
    {"id": "approved.model-provider", "retention": "third-party", "description": "Configured remote model provider selected by the user."},
    {"id": "approved.package-host", "retention": "third-party", "description": "Pinned model and runtime package download hosts."},
    {"id": "captured.dev-maildir", "retention": "dev-sink", "description": "Development-only Maildir that intentionally retains delivered mail."},
    {"id": "desktop.credential-store", "retention": "encrypted-local", "description": "Electron safeStorage or bounded session-memory premium credential store."},
    {"id": "desktop.main", "retention": "process", "description": "Credential-holding Electron main process."},
    {"id": "desktop.renderer", "retention": "process", "description": "Sandboxed credential-free Electron renderer."},
    {"id": "extension.local-storage", "retention": "local", "description": "Chrome storage.local only; storage.sync is not a zone."},
    {"id": "extension.runtime", "retention": "process", "description": "Extension popup and service-worker memory."},
    {"id": "local-engine.memory", "retention": "process", "description": "Local core engine process memory."},
    {"id": "local-engine.storage", "retention": "local", "description": "User-owned local jobs, library, transcripts, settings, subscriptions, cookies, and outbox."},
    {"id": "premium-service.database", "retention": "service-metadata", "description": "Premium database, structurally content-stateless for email."},
    {"id": "premium-service.memory", "retention": "request", "description": "Premium request-scoped application memory."},
    {"id": "private-web.browser", "retention": "browser", "description": "User browser connected over the private HTTPS serve surface."},
    {"id": "private-web.session", "retention": "session", "description": "Scoped HttpOnly private-web session credential."},
    {"id": "transcript-frame", "retention": "process", "description": "Opaque-origin sandboxed transcript iframe."},
    {"id": "user.external-browser", "retention": "third-party", "description": "System browser opened only by a user gesture."}
  ],
  "operations": [
    {"id": "android.engine.health", "surface": "android", "from_zone": "android.app", "to_zone": "local-engine.memory", "transport": "tailnet-https", "method": "GET", "route": "/v1/health", "request_contract": null, "response_contract": "engine-health-v1", "request_data": ["secret.engine-bearer"], "response_data": ["metadata.public-configuration"], "destination_persistence": [], "logging": [], "guards": ["bearer-auth", "no-cache", "no-cookies", "no-redirects"], "admitting_issue": "https://github.com/jim80net/podcast_reader/issues/152", "enforcement_ids": ["android.network-owner-inventory", "android.policy-projection"]},
    {"id": "android.engine.library", "surface": "android", "from_zone": "android.app", "to_zone": "local-engine.memory", "transport": "tailnet-https", "method": "GET", "route": "/v1/library", "request_contract": null, "response_contract": "engine-library-v1", "request_data": ["secret.engine-bearer"], "response_data": ["metadata.library"], "destination_persistence": [], "logging": [], "guards": ["bearer-auth", "bounded-response", "no-cache", "no-cookies", "no-redirects"], "admitting_issue": "https://github.com/jim80net/podcast_reader/issues/152", "enforcement_ids": ["android.network-owner-inventory", "android.policy-projection"]},
    {"id": "android.engine.pair-claim", "surface": "android", "from_zone": "android.app", "to_zone": "local-engine.memory", "transport": "tailnet-https", "method": "POST", "route": "/v1/pair/claim", "request_contract": "engine-pair-claim-v1", "response_contract": "engine-pair-token-v1", "request_data": ["secret.device-code"], "response_data": ["secret.engine-bearer"], "destination_persistence": [], "logging": [], "guards": ["explicit-user-action", "single-use-code", "tls"], "admitting_issue": "https://github.com/jim80net/podcast_reader/issues/152", "enforcement_ids": ["android.network-owner-inventory", "android.policy-projection"]},
    {"id": "android.engine.transcript", "surface": "android", "from_zone": "android.app", "to_zone": "local-engine.memory", "transport": "tailnet-https", "method": "GET", "route": "/v1/transcripts/{source_id}.html", "request_contract": "source-id-v1", "response_contract": "transcript-html-v1", "request_data": ["secret.engine-bearer"], "response_data": ["content.transcript-html"], "destination_persistence": [], "logging": [], "guards": ["bearer-auth", "bounded-response", "no-cache", "no-cookies", "no-redirects"], "admitting_issue": "https://github.com/jim80net/podcast_reader/issues/152", "enforcement_ids": ["android.network-owner-inventory", "android.policy-projection"]},
    {"id": "android.external-cta.open", "surface": "android", "from_zone": "android.app", "to_zone": "user.external-browser", "transport": "external-browser", "method": "OPEN", "route": "/house-creative/cta", "request_contract": "house-cta-v1", "response_contract": null, "request_data": ["locator.external-cta-url"], "response_data": [], "destination_persistence": [], "logging": [], "guards": ["https-only", "user-gesture"], "admitting_issue": "https://github.com/jim80net/podcast_reader/issues/152", "enforcement_ids": ["android.network-owner-inventory", "android.policy-projection"]},
    {"id": "android.premium.credentials-store", "surface": "android", "from_zone": "android.app", "to_zone": "android.credential-store", "transport": "encrypted-storage", "method": "WRITE", "route": "/premium-credentials", "request_contract": "android-premium-credentials-v1", "response_contract": null, "request_data": ["secret.premium-access", "secret.premium-refresh"], "response_data": [], "destination_persistence": ["secret.premium-access", "secret.premium-refresh"], "logging": [], "guards": ["domain-separated", "encrypted-at-rest", "exact-versioned-envelope"], "admitting_issue": "https://github.com/jim80net/podcast_reader/issues/152", "enforcement_ids": ["android.policy-projection"]},